"DESCRIPTION","DURATION IN MS","NAME","PARENT SUITE","START TIME","STATUS","STOP TIME","SUB SUITE","SUITE","TEST CLASS","TEST METHOD"
"Verifies that a description with 9,999 characters (one less than limit) passes validation.","51","test_description_boundary_limit_minus_1_passes","Near Citizens House","Wed Dec 17 20:57:42 UTC 2025","passed","Wed Dec 17 20:57:42 UTC 2025","Description Validation","Sputnik Bridge Unit Tests","",""
"","1","rejects all invalid examples from NEAR spec","Near Citizens House","Wed Dec 17 20:56:47 UTC 2025","passed","Wed Dec 17 20:56:47 UTC 2025","NEAR Account Validation > nearNamedAccountSchema > invalid named accounts","Shared Library Unit Tests","",""
"Verifies that are_accounts_verified enforces the batch size limit of 100 accounts.","3081","test_batch_size_limit_enforced","Near Citizens House","Wed Dec 17 21:07:20 UTC 2025","passed","Wed Dec 17 21:07:23 UTC 2025","Security","Verified Accounts Integration Tests","",""
"Verifies that MemberAddedEvent serializes correctly to JSON.","0","test_member_added_event_serializes_correctly","Near Citizens House","Wed Dec 17 20:57:42 UTC 2025","passed","Wed Dec 17 20:57:42 UTC 2025","Events","Sputnik Bridge Unit Tests","",""
"Verifies that pagination is capped at 100 items even when requesting more.","109331","test_pagination_limit_capped_at_100","Near Citizens House","Wed Dec 17 21:07:05 UTC 2025","passed","Wed Dec 17 21:08:54 UTC 2025","Pagination","Verified Accounts Integration Tests","",""
"","0","should parse valid plain JSON input","Near Citizens House","Wed Dec 17 20:56:43 UTC 2025","passed","Wed Dec 17 20:56:43 UTC 2025","NEP-413 Verification > parseUserContextData > Happy Path","Shared Library Unit Tests","",""
"Verifies that get_account returns None for non-existent accounts.","51","test_get_account_empty","Near Citizens House","Wed Dec 17 20:57:32 UTC 2025","passed","Wed Dec 17 20:57:32 UTC 2025","Composability Interface","Verified Accounts Unit Tests","",""
"Verifies that the bridge role has add_member_to_role:AddProposal and VoteApprove permissions for auto-approval.","5460","test_dao_init_bridge_has_add_member_permission","Near Citizens House","Wed Dec 17 21:19:05 UTC 2025","passed","Wed Dec 17 21:19:11 UTC 2025","DAO Integration Setup","Sputnik Bridge Integration Tests","",""
"Verifies that store_verification rejects when signature account_id doesn't match near_account_id parameter.","51","test_account_id_mismatch","Near Citizens House","Wed Dec 17 20:57:32 UTC 2025","passed","Wed Dec 17 20:57:32 UTC 2025","Input Validation","Verified Accounts Unit Tests","",""
"Test 1.1.4: Verifies that the contract cannot be reinitialized after initial setup.","3702","test_init_cannot_reinitialize","Near Citizens House","Wed Dec 17 21:06:50 UTC 2025","passed","Wed Dec 17 21:06:53 UTC 2025","Initialization","Verified Accounts Integration Tests","",""
"Verifies that when auto-approve fails (due to missing permissions), no member_added event is emitted and the user is not added.","7863","test_add_member_auto_approve_failure_no_event","Near Citizens House","Wed Dec 17 21:16:43 UTC 2025","passed","Wed Dec 17 21:16:51 UTC 2025","Failure Handling","Sputnik Bridge Integration Tests","",""
"Verifies that nonces shorter than 32 bytes are rejected.","49","test_invalid_nonce_length","Near Citizens House","Wed Dec 17 20:57:33 UTC 2025","passed","Wed Dec 17 20:57:33 UTC 2025","Signature Verification","Verified Accounts Unit Tests","",""
"
## Purpose
Verifies the complete happy path for adding a verified user as a citizen through the bridge.

## Flow
1. User gets verified in verified-accounts contract
2. Backend calls add_member on bridge
3. Bridge verifies user and creates SputnikDAO proposal
4. Proposal is auto-approved, user becomes citizen
","8405","test_add_verified_member_success","Near Citizens House","Wed Dec 17 21:17:46 UTC 2025","passed","Wed Dec 17 21:17:55 UTC 2025","Member Addition","Sputnik Bridge Integration Tests","",""
"Verifies pagination and batch queries return correct data when contract has verified accounts.","75","test_read_functions_with_verified_accounts","Near Citizens House","Wed Dec 17 20:57:33 UTC 2025","passed","Wed Dec 17 20:57:33 UTC 2025","Read Functions","Verified Accounts Unit Tests","",""
"Verifies that store_verification rejects user_context_data strings exceeding 4096 character maximum length.","49","test_user_context_data_too_long","Near Citizens House","Wed Dec 17 20:57:32 UTC 2025","passed","Wed Dec 17 20:57:32 UTC 2025","Input Validation","Verified Accounts Unit Tests","",""
"
## Purpose
Verifies that creating a proposal with exactly the required bond (1 NEAR) succeeds.

## Test 11.1.5 - create_proposal_with_exact_bond

## Expected
Transaction succeeds with exactly 1 NEAR deposit.
","5819","test_create_proposal_with_exact_bond","Near Citizens House","Wed Dec 17 21:15:53 UTC 2025","passed","Wed Dec 17 21:15:59 UTC 2025","Edge Cases","Sputnik Bridge Integration Tests","",""
"Verifies that multiple members can be added in rapid succession without state corruption. Note: Additions are sequential (not truly concurrent) due to blockchain transaction ordering, but rapid succession still tests for race conditions in state management.","22548","test_rapid_sequential_member_additions","Near Citizens House","Wed Dec 17 21:15:59 UTC 2025","passed","Wed Dec 17 21:16:22 UTC 2025","Edge Cases","Sputnik Bridge Integration Tests","",""
"Verifies that a proposal remains InProgress when participation meets quorum but YES votes don't reach the threshold.","81743","test_vote_proposal_quorum_passes_threshold_fails","Near Citizens House","Wed Dec 17 21:12:58 UTC 2025","passed","Wed Dec 17 21:14:20 UTC 2025","Dynamic Quorum","Sputnik Bridge Integration Tests","",""
"","0","test_all_action_variants_serialization","Near Citizens House","Wed Dec 17 20:57:45 UTC 2025","passed","Wed Dec 17 20:57:45 UTC 2025","Serialization","Sputnik DAO Interface Tests","",""
"","0","should build proof data from valid inputs","Near Citizens House","Wed Dec 17 20:56:43 UTC 2025","passed","Wed Dec 17 20:56:43 UTC 2025","NEP-413 Verification > buildProofData > Happy Path","Shared Library Unit Tests","",""
"","0","should handle mixed binary and JSON data","Near Citizens House","Wed Dec 17 20:56:43 UTC 2025","passed","Wed Dec 17 20:56:43 UTC 2025","NEP-413 Verification > parseUserContextData > Edge Cases","Shared Library Unit Tests","",""
"Verifies that the DAO has an empty citizen role initially, ready for citizens to be added.","5367","test_dao_init_with_citizen_role","Near Citizens House","Wed Dec 17 21:19:16 UTC 2025","passed","Wed Dec 17 21:19:21 UTC 2025","DAO Integration Setup","Sputnik Bridge Integration Tests","",""
"","2","rejects consecutive separators","Near Citizens House","Wed Dec 17 20:56:47 UTC 2025","passed","Wed Dec 17 20:56:47 UTC 2025","NEAR Account Validation > nearNamedAccountSchema > invalid named accounts","Shared Library Unit Tests","",""
"Verifies that citizens cannot use VoteRemove action as they only have VoteApprove and VoteReject permissions.","9864","test_citizen_cannot_vote_remove","Near Citizens House","Wed Dec 17 21:18:50 UTC 2025","passed","Wed Dec 17 21:18:59 UTC 2025","Access Control","Sputnik Bridge Integration Tests","",""
"","0","should handle malformed proof with missing fields","Near Citizens House","Wed Dec 17 20:56:45 UTC 2025","passed","Wed Dec 17 20:56:45 UTC 2025","ZK Verification > verifyStoredProofWithDetails > Negative Tests","Shared Library Unit Tests","",""
"","56","should support Passport attestation (ID=1)","Near Citizens House","Wed Dec 17 20:56:44 UTC 2025","passed","Wed Dec 17 20:56:44 UTC 2025","ZK Verification > verifyStoredProof > Positive Tests - Attestation Types","Shared Library Unit Tests","",""
"
## Purpose
Verifies that unicode characters (emoji, CJK, Arabic) are preserved in proposal descriptions.

## Unicode Support
Tests multi-language support: ""Vote on 🗳️ proposal 提案 مقترح""
","6351","test_create_proposal_unicode_description","Near Citizens House","Wed Dec 17 21:18:21 UTC 2025","passed","Wed Dec 17 21:18:27 UTC 2025","Proposal Validation","Sputnik Bridge Integration Tests","",""
"Verifies that only the backend wallet can store verifications and unauthorized accounts are rejected.","89","test_unauthorized_write","Near Citizens House","Wed Dec 17 20:57:32 UTC 2025","passed","Wed Dec 17 20:57:32 UTC 2025","Access Control","Verified Accounts Unit Tests","",""
"Verifies the same NEAR account cannot be verified twice even with new signatures/nullifiers.","76","test_double_verification_rejected","Near Citizens House","Wed Dec 17 20:57:33 UTC 2025","passed","Wed Dec 17 20:57:33 UTC 2025","Store Verification","Verified Accounts Unit Tests","",""
"Verifies that all contracts are deployed and the bridge is initialized with correct configuration.","5378","test_full_setup","Near Citizens House","Wed Dec 17 21:19:21 UTC 2025","passed","Wed Dec 17 21:19:27 UTC 2025","Contract Setup","Sputnik Bridge Integration Tests","",""
"Verifies 100 * 7 / 100 = 7.0 exactly (no ceiling needed).","1","test_quorum_with_100_citizens_equals_7","Near Citizens House","Wed Dec 17 20:57:42 UTC 2025","passed","Wed Dec 17 20:57:42 UTC 2025","Quorum Calculation","Sputnik Bridge Unit Tests","",""
"","4","should reject invalid signature","Near Citizens House","Wed Dec 17 20:56:43 UTC 2025","passed","Wed Dec 17 20:56:43 UTC 2025","NEP-413 Verification > verifyNearSignature > Negative Tests","Shared Library Unit Tests","",""
"Verifies MAX_DESCRIPTION_LEN constant is positive.","1","test_invariant_max_description_length_positive","Near Citizens House","Wed Dec 17 20:57:42 UTC 2025","passed","Wed Dec 17 20:57:42 UTC 2025","Invariants","Sputnik Bridge Unit Tests","",""
"","0","test_change_policy_add_or_update_role_serialization","Near Citizens House","Wed Dec 17 20:57:45 UTC 2025","passed","Wed Dec 17 20:57:45 UTC 2025","Serialization","Sputnik DAO Interface Tests","",""
"","4","should handle 64-byte signature (Ed25519 standard)","Near Citizens House","Wed Dec 17 20:56:43 UTC 2025","passed","Wed Dec 17 20:56:43 UTC 2025","NEP-413 Verification > verifyNearSignature > Boundary Tests","Shared Library Unit Tests","",""
"","0","identifies implicit accounts","Near Citizens House","Wed Dec 17 20:56:47 UTC 2025","passed","Wed Dec 17 20:56:47 UTC 2025","NEAR Account Validation > getNearAccountType","Shared Library Unit Tests","",""
"Verifies that creating a proposal with a whitespace-only description fails.","51","test_create_proposal_whitespace_only_description_fails","Near Citizens House","Wed Dec 17 20:57:42 UTC 2025","passed","Wed Dec 17 20:57:42 UTC 2025","Description Validation","Sputnik Bridge Unit Tests","",""
"
## Purpose
Verifies that creating a proposal returns an incrementing ID and the proposal is of type Vote.

## Expected
- Proposal ID increments after creation
- Proposal type is ""Vote""
","5865","test_create_proposal_returns_id","Near Citizens House","Wed Dec 17 21:18:10 UTC 2025","passed","Wed Dec 17 21:18:15 UTC 2025","Proposal Creation","Sputnik Bridge Integration Tests","",""
"","0","test_role_kind_group_serialization","Near Citizens House","Wed Dec 17 20:57:45 UTC 2025","passed","Wed Dec 17 20:57:45 UTC 2025","Serialization","Sputnik DAO Interface Tests","",""
"","1","rejects accounts shorter than 2 chars","Near Citizens House","Wed Dec 17 20:56:47 UTC 2025","passed","Wed Dec 17 20:56:47 UTC 2025","NEAR Account Validation > nearNamedAccountSchema > invalid named accounts","Shared Library Unit Tests","",""
"Verifies that the backend wallet can be updated and the new wallet gains proper permissions.","4719","test_update_backend_wallet","Near Citizens House","Wed Dec 17 21:06:37 UTC 2025","passed","Wed Dec 17 21:06:42 UTC 2025","Access Control","Verified Accounts Integration Tests","",""
"","1","should produce different hash for different messages","Near Citizens House","Wed Dec 17 20:56:43 UTC 2025","passed","Wed Dec 17 20:56:43 UTC 2025","NEP-413 Verification > computeNep413Hash > Happy Path","Shared Library Unit Tests","",""
"Verifies that verified_at matches the block timestamp when the verification was stored.","47","test_verification_timestamp_matches_block_time","Near Citizens House","Wed Dec 17 20:57:33 UTC 2025","passed","Wed Dec 17 20:57:33 UTC 2025","Store Verification","Verified Accounts Unit Tests","",""
"Verifies that a council member can vote to reject a proposal.","4827","test_dao_proposal_rejection","Near Citizens House","Wed Dec 17 21:09:41 UTC 2025","passed","Wed Dec 17 21:09:46 UTC 2025","DAO Sanity Tests","Sputnik Bridge Integration Tests","",""
"Verifies that when the verification contract promise fails, the entire flow is aborted with no events or state changes.","6869","test_verification_promise_failure_no_event","Near Citizens House","Wed Dec 17 21:17:13 UTC 2025","passed","Wed Dec 17 21:17:20 UTC 2025","Failure Handling","Sputnik Bridge Integration Tests","",""
"","0","should handle maximum allowed length (4096 chars)","Near Citizens House","Wed Dec 17 20:56:43 UTC 2025","passed","Wed Dec 17 20:56:43 UTC 2025","NEP-413 Verification > parseUserContextData > Boundary Tests","Shared Library Unit Tests","",""
"","0","test_verified_account_info_serialization","Near Citizens House","Wed Dec 17 20:57:36 UTC 2025","passed","Wed Dec 17 20:57:36 UTC 2025","Serialization","Verified Accounts Interface Tests","",""
"
## Purpose
Verifies that VoteApprove from a single citizen results in Approved status.

## Expected
With only 1 citizen voting approve, proposal status becomes Approved.
","9984","test_citizen_vote_approve","Near Citizens House","Wed Dec 17 21:20:24 UTC 2025","passed","Wed Dec 17 21:20:34 UTC 2025","Citizen Voting","Sputnik Bridge Integration Tests","",""
"","0","should handle input exceeding typical maximum length","Near Citizens House","Wed Dec 17 20:56:43 UTC 2025","passed","Wed Dec 17 20:56:43 UTC 2025","NEP-413 Verification > parseUserContextData > Boundary Tests","Shared Library Unit Tests","",""
"Verifies that store_verification rejects ZK proof with 'c' component strings exceeding 80 character maximum length.","50","test_proof_component_c_too_long","Near Citizens House","Wed Dec 17 20:57:33 UTC 2025","passed","Wed Dec 17 20:57:33 UTC 2025","Proof Validation","Verified Accounts Unit Tests","",""
"Verifies that empty citizen_role is rejected during initialization.","50","test_initialization_empty_citizen_role_fails","Near Citizens House","Wed Dec 17 20:57:42 UTC 2025","passed","Wed Dec 17 20:57:42 UTC 2025","Initialization","Sputnik Bridge Unit Tests","",""
"","0","test_proposal_input_borsh_roundtrip","Near Citizens House","Wed Dec 17 20:57:45 UTC 2025","passed","Wed Dec 17 20:57:45 UTC 2025","Serialization","Sputnik DAO Interface Tests","",""
"Verifies callback emits quorum_updated event when quorum update is successfully approved.","49","test_callback_quorum_updated","Near Citizens House","Wed Dec 17 20:57:42 UTC 2025","passed","Wed Dec 17 20:57:42 UTC 2025","Callbacks","Sputnik Bridge Unit Tests","",""
"","0","should handle JSON with null bytes","Near Citizens House","Wed Dec 17 20:56:43 UTC 2025","passed","Wed Dec 17 20:56:43 UTC 2025","NEP-413 Verification > parseUserContextData > Edge Cases","Shared Library Unit Tests","",""
"Verifies that user_context_data at the 4096 character limit is accepted.","71","test_user_context_data_max_length_allowed","Near Citizens House","Wed Dec 17 20:57:32 UTC 2025","passed","Wed Dec 17 20:57:32 UTC 2025","Input Validation","Verified Accounts Unit Tests","",""
"","0","should handle hex with leading zeros","Near Citizens House","Wed Dec 17 20:56:43 UTC 2025","passed","Wed Dec 17 20:56:43 UTC 2025","NEP-413 Verification > parseUserContextData > Edge Cases","Shared Library Unit Tests","",""
"Verifies unauthorized account cannot add member and receives appropriate error.","111","test_add_member_unauthorized_fails","Near Citizens House","Wed Dec 17 20:57:42 UTC 2025","passed","Wed Dec 17 20:57:42 UTC 2025","Access Control","Sputnik Bridge Unit Tests","",""
"","0","test_verified_account_info_json_roundtrip","Near Citizens House","Wed Dec 17 20:57:36 UTC 2025","passed","Wed Dec 17 20:57:36 UTC 2025","Serialization","Verified Accounts Interface Tests","",""
"Verifies callback emits proposal_created event when vote proposal is successfully created.","49","test_callback_vote_proposal_created","Near Citizens House","Wed Dec 17 20:57:42 UTC 2025","passed","Wed Dec 17 20:57:42 UTC 2025","Callbacks","Sputnik Bridge Unit Tests","",""
"","0","test_verified_account_info_json_missing_nullifier_fails","Near Citizens House","Wed Dec 17 20:57:36 UTC 2025","passed","Wed Dec 17 20:57:36 UTC 2025","Validation","Verified Accounts Interface Tests","",""
"Verifies callback successfully processes verified account and schedules add_proposal.","50","test_callback_add_member_verified","Near Citizens House","Wed Dec 17 20:57:42 UTC 2025","passed","Wed Dec 17 20:57:42 UTC 2025","Callbacks","Sputnik Bridge Unit Tests","",""
"","0","should handle minimum valid inputs","Near Citizens House","Wed Dec 17 20:56:43 UTC 2025","passed","Wed Dec 17 20:56:43 UTC 2025","NEP-413 Verification > buildProofData > Edge Cases","Shared Library Unit Tests","",""
"","0","identifies named accounts","Near Citizens House","Wed Dec 17 20:56:47 UTC 2025","passed","Wed Dec 17 20:56:47 UTC 2025","NEAR Account Validation > getNearAccountType","Shared Library Unit Tests","",""
"Verifies that when proposal creation fails at the DAO level (e.g., insufficient deposit), no proposal_created event is emitted.","5871","test_create_proposal_dao_failure_no_event","Near Citizens House","Wed Dec 17 21:16:55 UTC 2025","passed","Wed Dec 17 21:17:01 UTC 2025","Failure Handling","Sputnik Bridge Integration Tests","",""
"","0","test_self_proof_data_json_roundtrip","Near Citizens House","Wed Dec 17 20:57:36 UTC 2025","passed","Wed Dec 17 20:57:36 UTC 2025","Serialization","Verified Accounts Interface Tests","",""
"Verifies that anyone can finalize expired proposals as per the 'all' role permissions in the DAO policy.","8374","test_anyone_can_finalize_proposal","Near Citizens House","Wed Dec 17 21:18:29 UTC 2025","passed","Wed Dec 17 21:18:38 UTC 2025","Access Control","Sputnik Bridge Integration Tests","",""
"Verifies that store_verification rejects ZK proof with public_signals array exceeding maximum length of 21.","50","test_public_signals_too_many","Near Citizens House","Wed Dec 17 20:57:33 UTC 2025","passed","Wed Dec 17 20:57:33 UTC 2025","Proof Validation","Verified Accounts Unit Tests","",""
"Verifies MAX_DESCRIPTION_LENGTH constant has expected value of 10,000 characters.","0","test_max_description_length_constant","Near Citizens House","Wed Dec 17 20:57:42 UTC 2025","passed","Wed Dec 17 20:57:42 UTC 2025","Constants","Sputnik Bridge Unit Tests","",""
"Verifies that all-zeros nonce (edge case - weak randomness) is accepted.","4901","test_nonce_all_zeros","Near Citizens House","Wed Dec 17 21:06:42 UTC 2025","passed","Wed Dec 17 21:06:47 UTC 2025","Edge Cases","Verified Accounts Integration Tests","",""
"Verifies that gas exhaustion during cross-contract calls doesn't cause partial state corruption and user is not added.","6395","test_gas_exhaustion_partial_operation","Near Citizens House","Wed Dec 17 21:16:58 UTC 2025","passed","Wed Dec 17 21:17:04 UTC 2025","Failure Handling","Sputnik Bridge Integration Tests","",""
"Verifies quorum is 0 when there are no citizens.","0","test_quorum_with_0_citizens_equals_0","Near Citizens House","Wed Dec 17 20:57:42 UTC 2025","passed","Wed Dec 17 20:57:42 UTC 2025","Quorum Calculation","Sputnik Bridge Unit Tests","",""
"Verifies that quorum is monotonically increasing as citizen count grows.","0","test_invariant_quorum_monotonic_increasing","Near Citizens House","Wed Dec 17 20:57:42 UTC 2025","passed","Wed Dec 17 20:57:42 UTC 2025","Invariants","Sputnik Bridge Unit Tests","",""
"","3","should handle proof components exceeding typical size limits","Near Citizens House","Wed Dec 17 20:56:45 UTC 2025","passed","Wed Dec 17 20:56:45 UTC 2025","ZK Verification > verifyStoredProofWithDetails > Boundary Tests","Shared Library Unit Tests","",""
"","0","test_weight_kind_serialization","Near Citizens House","Wed Dec 17 20:57:45 UTC 2025","passed","Wed Dec 17 20:57:45 UTC 2025","Serialization","Sputnik DAO Interface Tests","",""
"Verifies that callback_proposal_created cannot be called externally, protected by #[private] macro. Security-critical test.","6323","test_callback_proposal_created_cannot_be_called_externally","Near Citizens House","Wed Dec 17 21:18:39 UTC 2025","passed","Wed Dec 17 21:18:45 UTC 2025","Callback Security","Sputnik Bridge Integration Tests","",""
"Verifies the critical 0-to-1 citizen transition, where quorum updates from 0 to 1 and the first citizen can approve proposals.","10654","test_zero_to_one_citizen_quorum_transition","Near Citizens House","Wed Dec 17 21:15:04 UTC 2025","passed","Wed Dec 17 21:15:14 UTC 2025","Dynamic Quorum","Sputnik Bridge Integration Tests","",""
"","0","accepts 64 lowercase hex chars","Near Citizens House","Wed Dec 17 20:56:47 UTC 2025","passed","Wed Dec 17 20:56:47 UTC 2025","NEAR Account Validation > nearImplicitAccountSchema > valid implicit accounts","Shared Library Unit Tests","",""
"Verifies that store_verification rejects nullifier strings exceeding 80 character maximum length.","50","test_nullifier_too_long","Near Citizens House","Wed Dec 17 20:57:32 UTC 2025","passed","Wed Dec 17 20:57:32 UTC 2025","Input Validation","Verified Accounts Unit Tests","",""
"
## Purpose
Verifies that empty descriptions are rejected during proposal creation.

## Input Validation
Empty string """" should be rejected with ""cannot be empty"" error.
","5331","test_create_proposal_empty_description","Near Citizens House","Wed Dec 17 21:18:01 UTC 2025","passed","Wed Dec 17 21:18:07 UTC 2025","Proposal Validation","Sputnik Bridge Integration Tests","",""
"Verifies that the backend wallet can update its address to a new wallet.","6406","test_update_backend_wallet","Near Citizens House","Wed Dec 17 21:09:28 UTC 2025","passed","Wed Dec 17 21:09:34 UTC 2025","Backend Wallet Management","Sputnik Bridge Integration Tests","",""
"Verifies that the get_info view function returns correct bridge configuration details.","5402","test_get_info","Near Citizens House","Wed Dec 17 21:19:22 UTC 2025","passed","Wed Dec 17 21:19:27 UTC 2025","Read Functions","Sputnik Bridge Integration Tests","",""
"Verifies that creating a proposal with an empty description fails.","50","test_create_proposal_empty_description_fails","Near Citizens House","Wed Dec 17 20:57:42 UTC 2025","passed","Wed Dec 17 20:57:42 UTC 2025","Description Validation","Sputnik Bridge Unit Tests","",""
"Verifies that a proposal remains InProgress when not enough votes are cast to reach the effective threshold.","42868","test_vote_proposal_quorum_fails","Near Citizens House","Wed Dec 17 21:11:36 UTC 2025","passed","Wed Dec 17 21:12:19 UTC 2025","Dynamic Quorum","Sputnik Bridge Integration Tests","",""
"Verifies that quorum updates are atomic with member addition, with both member_added and quorum_updated events emitted.","8937","test_quorum_update_atomic_with_member_addition","Near Citizens House","Wed Dec 17 21:10:44 UTC 2025","passed","Wed Dec 17 21:10:53 UTC 2025","Dynamic Quorum","Sputnik Bridge Integration Tests","",""
"Documents that WeightOrRatio::Ratio allows zero denominator at the type level. This is a dangerous edge case that could cause division-by-zero in consuming contracts. Validation must happen in the DAO contract, not the interface.","0","test_weight_or_ratio_zero_denominator_allowed","Near Citizens House","Wed Dec 17 20:57:45 UTC 2025","passed","Wed Dec 17 20:57:45 UTC 2025","Validation","Sputnik DAO Interface Tests","",""
"
## Purpose
Verifies that add_member creates a proposal in SputnikDAO.

## Expected
Proposal count increases after add_member call.
","8345","test_add_member_creates_proposal","Near Citizens House","Wed Dec 17 21:17:25 UTC 2025","passed","Wed Dec 17 21:17:33 UTC 2025","Member Addition","Sputnik Bridge Integration Tests","",""
"Verifies that the backend wallet can pause and unpause the contract correctly.","4299","test_authorized_pause_unpause","Near Citizens House","Wed Dec 17 21:06:29 UTC 2025","passed","Wed Dec 17 21:06:34 UTC 2025","Access Control","Verified Accounts Integration Tests","",""
"
## Purpose
Verifies that a verified citizen can successfully vote on a proposal.

## Flow
1. User gets verified through verified-accounts
2. User is added as citizen through bridge
3. Backend creates a proposal
4. Citizen votes on the proposal

## Expected
Vote transaction succeeds.
","10469","test_citizen_can_vote_on_proposal","Near Citizens House","Wed Dec 17 21:20:15 UTC 2025","passed","Wed Dec 17 21:20:26 UTC 2025","Citizen Voting","Sputnik Bridge Integration Tests","",""
"Verifies that the bridge role has policy_add_or_update_role permissions for quorum updates.","5366","test_dao_init_bridge_has_policy_update_permission","Near Citizens House","Wed Dec 17 21:19:11 UTC 2025","passed","Wed Dec 17 21:19:16 UTC 2025","DAO Integration Setup","Sputnik Bridge Integration Tests","",""
"","0","should return null for missing required fields","Near Citizens House","Wed Dec 17 20:56:43 UTC 2025","passed","Wed Dec 17 20:56:43 UTC 2025","NEP-413 Verification > parseUserContextData > Negative Tests","Shared Library Unit Tests","",""
"
## Purpose
Verifies that adding a member with exactly the required bond (1 NEAR) succeeds.

## Test 11.1.2 - add_member_with_exact_bond_succeeds

## Expected
Transaction succeeds with exactly 1 NEAR deposit.
","8926","test_add_member_with_exact_bond_succeeds","Near Citizens House","Wed Dec 17 21:15:21 UTC 2025","passed","Wed Dec 17 21:15:30 UTC 2025","Edge Cases","Sputnik Bridge Integration Tests","",""
