"DESCRIPTION","DURATION IN MS","NAME","PARENT SUITE","START TIME","STATUS","STOP TIME","SUB SUITE","SUITE","TEST CLASS","TEST METHOD"
"","10","should reject signature from wrong signer","Near Citizens House","Wed Dec 17 20:56:43 UTC 2025","passed","Wed Dec 17 20:56:43 UTC 2025","NEP-413 Verification > verifyNearSignature > Negative Tests","Shared Library Unit Tests","",""
"","0","should convert base64 nonce to array","Near Citizens House","Wed Dec 17 20:56:43 UTC 2025","passed","Wed Dec 17 20:56:43 UTC 2025","NEP-413 Verification > parseUserContextData > Positive Tests","Shared Library Unit Tests","",""
"","58","should default to attestationId=1 when not specified","Near Citizens House","Wed Dec 17 20:56:44 UTC 2025","passed","Wed Dec 17 20:56:44 UTC 2025","ZK Verification > verifyStoredProof > Edge Cases","Shared Library Unit Tests","",""
"Verifies that unicode characters in role name are accepted.","5380","test_init_with_unicode_role_name","Near Citizens House","Wed Dec 17 21:19:35 UTC 2025","passed","Wed Dec 17 21:19:40 UTC 2025","Contract Setup","Sputnik Bridge Integration Tests","",""
"","176","should cache successful RPC endpoint","Near Citizens House","Wed Dec 17 20:56:46 UTC 2025","passed","Wed Dec 17 20:56:46 UTC 2025","ZK Verification > RPC Failover Mechanism > Positive Tests","Shared Library Unit Tests","",""
"Verifies that a description with exactly 10,000 characters (at limit) passes validation.","51","test_description_boundary_at_limit_passes","Near Citizens House","Wed Dec 17 20:57:42 UTC 2025","passed","Wed Dec 17 20:57:42 UTC 2025","Description Validation","Sputnik Bridge Unit Tests","",""
"","0","rejects wrong length","Near Citizens House","Wed Dec 17 20:56:47 UTC 2025","passed","Wed Dec 17 20:56:47 UTC 2025","NEAR Account Validation > nearImplicitAccountSchema > invalid implicit accounts","Shared Library Unit Tests","",""
"Verifies signature replay protection rejects storing the same signature twice.","73","test_signature_replay_rejected","Near Citizens House","Wed Dec 17 20:57:33 UTC 2025","passed","Wed Dec 17 20:57:33 UTC 2025","Store Verification","Verified Accounts Unit Tests","",""
"Verifies callback handles promise failure during proposal creation with appropriate error.","50","test_callback_proposal_created_promise_failed","Near Citizens House","Wed Dec 17 20:57:42 UTC 2025","passed","Wed Dec 17 20:57:42 UTC 2025","Callbacks","Sputnik Bridge Unit Tests","",""
"","0","test_add_member_to_role_serialization","Near Citizens House","Wed Dec 17 20:57:45 UTC 2025","passed","Wed Dec 17 20:57:45 UTC 2025","Serialization","Sputnik DAO Interface Tests","",""
"Tests boundary transition from 2 to 3 quorum (28→29 citizens).","0","test_quorum_boundary_2_to_3","Near Citizens House","Wed Dec 17 20:57:42 UTC 2025","passed","Wed Dec 17 20:57:42 UTC 2025","Quorum Boundaries","Sputnik Bridge Unit Tests","",""
"The Groth16 verifier expects b coordinates in swapped order: b[i][1], b[i][0] instead of b[i][0], b[i][1]. This test verifies the swap is applied.","53","should handle proof b coordinate swap correctly","Near Citizens House","Wed Dec 17 20:56:44 UTC 2025","passed","Wed Dec 17 20:56:44 UTC 2025","ZK Verification > verifyStoredProof > Edge Cases","Shared Library Unit Tests","",""
"","1","rejects uppercase letters","Near Citizens House","Wed Dec 17 20:56:47 UTC 2025","passed","Wed Dec 17 20:56:47 UTC 2025","NEAR Account Validation > nearNamedAccountSchema > invalid named accounts","Shared Library Unit Tests","",""
"Verifies that are_accounts_verified rejects batch queries exceeding maximum size of 100 accounts.","51","test_batch_size_exceeded_are_accounts_verified","Near Citizens House","Wed Dec 17 20:57:32 UTC 2025","passed","Wed Dec 17 20:57:32 UTC 2025","Input Validation","Verified Accounts Unit Tests","",""
"","1","should produce deterministic hash for same inputs","Near Citizens House","Wed Dec 17 20:56:43 UTC 2025","passed","Wed Dec 17 20:56:43 UTC 2025","NEP-413 Verification > computeNep413Hash > Happy Path","Shared Library Unit Tests","",""
"","5","should verify signature with unicode challenge","Near Citizens House","Wed Dec 17 20:56:43 UTC 2025","passed","Wed Dec 17 20:56:43 UTC 2025","NEP-413 Verification > verifyNearSignature > Positive Tests","Shared Library Unit Tests","",""
"Verifies that a non-council member cannot create proposals when they lack the AddProposal permission.","4823","test_dao_non_council_cannot_create_proposal","Near Citizens House","Wed Dec 17 21:09:37 UTC 2025","passed","Wed Dec 17 21:09:41 UTC 2025","DAO Sanity Tests","Sputnik Bridge Integration Tests","",""
"Verifies callback handles promise failure when approving quorum update with appropriate error.","50","test_callback_quorum_updated_promise_failed","Near Citizens House","Wed Dec 17 20:57:42 UTC 2025","passed","Wed Dec 17 20:57:42 UTC 2025","Callbacks","Sputnik Bridge Unit Tests","",""
"","0","test_zk_proof_json_roundtrip","Near Citizens House","Wed Dec 17 20:57:36 UTC 2025","passed","Wed Dec 17 20:57:36 UTC 2025","Serialization","Verified Accounts Interface Tests","",""
"","0","returns null for invalid accounts","Near Citizens House","Wed Dec 17 20:56:47 UTC 2025","passed","Wed Dec 17 20:56:47 UTC 2025","NEAR Account Validation > getNearAccountType","Shared Library Unit Tests","",""
"Verifies callback emits member_added event and schedules get_policy when member is successfully added.","50","test_callback_member_added","Near Citizens House","Wed Dec 17 20:57:42 UTC 2025","passed","Wed Dec 17 20:57:42 UTC 2025","Callbacks","Sputnik Bridge Unit Tests","",""
"Verifies that nonces longer than 32 bytes are rejected.","52","test_nonce_too_long","Near Citizens House","Wed Dec 17 20:57:33 UTC 2025","passed","Wed Dec 17 20:57:33 UTC 2025","Signature Verification","Verified Accounts Unit Tests","",""
"","62","should resolve verifier contract for attestation ID 1","Near Citizens House","Wed Dec 17 20:56:46 UTC 2025","passed","Wed Dec 17 20:56:46 UTC 2025","ZK Verification > Verifier Contract Resolution > Happy Path","Shared Library Unit Tests","",""
"","1","should return error for invalid public key","Near Citizens House","Wed Dec 17 20:56:43 UTC 2025","passed","Wed Dec 17 20:56:43 UTC 2025","NEP-413 Verification > verifyNearSignature > Negative Tests","Shared Library Unit Tests","",""
"Verifies that adding a member with zero deposit fails as expected.","7390","test_add_member_zero_deposit","Near Citizens House","Wed Dec 17 21:15:37 UTC 2025","passed","Wed Dec 17 21:15:45 UTC 2025","Edge Cases","Sputnik Bridge Integration Tests","",""
"
## Purpose
Verifies that descriptions at exactly the max length (10,000 chars) are accepted.

## Boundary Test
- Input: Exactly 10,000 characters (limit)
- Expected: Succeeds
","6398","test_create_proposal_exactly_max_length","Near Citizens House","Wed Dec 17 21:18:03 UTC 2025","passed","Wed Dec 17 21:18:10 UTC 2025","Proposal Validation","Sputnik Bridge Integration Tests","",""
"
## Purpose
Verifies that voting within the valid period succeeds (baseline for expiry test).

## Expected
Immediate vote after proposal creation should succeed.
","9899","test_vote_before_expiry_succeeds","Near Citizens House","Wed Dec 17 21:20:57 UTC 2025","passed","Wed Dec 17 21:21:07 UTC 2025","Proposal Lifecycle","Sputnik Bridge Integration Tests","",""
"Verifies quorum calculation scales correctly with large citizen counts.","0","test_quorum_large_numbers","Near Citizens House","Wed Dec 17 20:57:42 UTC 2025","passed","Wed Dec 17 20:57:42 UTC 2025","Quorum Calculation","Sputnik Bridge Unit Tests","",""
"","1","returns false for invalid accounts","Near Citizens House","Wed Dec 17 20:56:47 UTC 2025","passed","Wed Dec 17 20:56:47 UTC 2025","NEAR Account Validation > isValidNearAccountId","Shared Library Unit Tests","",""
"","0","rejects accounts ending with separator","Near Citizens House","Wed Dec 17 20:56:47 UTC 2025","passed","Wed Dec 17 20:56:47 UTC 2025","NEAR Account Validation > nearNamedAccountSchema > invalid named accounts","Shared Library Unit Tests","",""
"
## Purpose
Verifies that unverified users cannot be added as citizens.

## Sybil Resistance
Bridge checks verification status before creating proposal.
","6348","test_add_unverified_member_fails","Near Citizens House","Wed Dec 17 21:17:40 UTC 2025","passed","Wed Dec 17 21:17:46 UTC 2025","Member Addition","Sputnik Bridge Integration Tests","",""
"
## Purpose
Verifies that multiple users can be added as citizens sequentially.

## Expected
All 3 users end up in the citizen role.
","15472","test_add_multiple_members","Near Citizens House","Wed Dec 17 21:17:37 UTC 2025","passed","Wed Dec 17 21:17:52 UTC 2025","Member Addition","Sputnik Bridge Integration Tests","",""
"Verifies that changing the recipient after signing invalidates the signature.","50","test_signature_wrong_recipient_rejected","Near Citizens House","Wed Dec 17 20:57:33 UTC 2025","passed","Wed Dec 17 20:57:33 UTC 2025","Signature Verification","Verified Accounts Unit Tests","",""
"Verifies callback successfully processes quorum proposal creation and schedules get_proposal.","50","test_callback_quorum_proposal_created","Near Citizens House","Wed Dec 17 20:57:42 UTC 2025","passed","Wed Dec 17 20:57:42 UTC 2025","Callbacks","Sputnik Bridge Unit Tests","",""
"","0","should handle empty message","Near Citizens House","Wed Dec 17 20:56:43 UTC 2025","passed","Wed Dec 17 20:56:43 UTC 2025","NEP-413 Verification > computeNep413Hash > Edge Cases","Shared Library Unit Tests","",""
"","0","rejects non-hex characters","Near Citizens House","Wed Dec 17 20:56:47 UTC 2025","passed","Wed Dec 17 20:56:47 UTC 2025","NEAR Account Validation > nearImplicitAccountSchema > invalid implicit accounts","Shared Library Unit Tests","",""
"","58","should handle invalid attestation ID gracefully","Near Citizens House","Wed Dec 17 20:56:45 UTC 2025","passed","Wed Dec 17 20:56:45 UTC 2025","ZK Verification > verifyStoredProofWithDetails > Negative Tests","Shared Library Unit Tests","",""
"","1","rejects accounts longer than 64 chars","Near Citizens House","Wed Dec 17 20:56:47 UTC 2025","passed","Wed Dec 17 20:56:47 UTC 2025","NEAR Account Validation > nearNamedAccountSchema > invalid named accounts","Shared Library Unit Tests","",""
"Verifies the quorum boundary transition from 14 to 15 citizens where quorum increases from 1 to 2.","57678","test_quorum_boundary_14_to_15_citizens","Near Citizens House","Wed Dec 17 21:09:46 UTC 2025","passed","Wed Dec 17 21:10:44 UTC 2025","Dynamic Quorum","Sputnik Bridge Integration Tests","",""
"
## Purpose
Verifies that AddMemberToRole proposals have the correct member_id and role.

## Test 8.3.2 & 8.3.3 - add_member_proposal_has_correct_member_id/role

## Expected
- Proposal kind is AddMemberToRole
- member_id matches the user being added
- role is ""citizen""
","8346","test_add_member_proposal_has_correct_content","Near Citizens House","Wed Dec 17 21:17:29 UTC 2025","passed","Wed Dec 17 21:17:37 UTC 2025","Member Addition","Sputnik Bridge Integration Tests","",""
"","1","should handle special characters in message","Near Citizens House","Wed Dec 17 20:56:43 UTC 2025","passed","Wed Dec 17 20:56:43 UTC 2025","NEP-413 Verification > computeNep413Hash > Edge Cases","Shared Library Unit Tests","",""
"
## Purpose
Verifies that proposals created via the bridge show the bridge contract as the proposer.

## Test 4.2.5 - bridge_proposal_shows_bridge_as_proposer

## Expected
Proposal.proposer == bridge contract account ID.
","8899","test_bridge_proposal_shows_bridge_as_proposer","Near Citizens House","Wed Dec 17 21:17:52 UTC 2025","passed","Wed Dec 17 21:18:01 UTC 2025","Member Addition","Sputnik Bridge Integration Tests","",""
"Verifies that bridge initialization succeeds even if the DAO contract doesn't exist. Cross-contract calls will fail later.","3762","test_init_with_nonexistent_dao","Near Citizens House","Wed Dec 17 21:19:27 UTC 2025","passed","Wed Dec 17 21:19:31 UTC 2025","Contract Setup","Sputnik Bridge Integration Tests","",""
"Verifies that sequential voting correctly auto-approves when threshold is reached and rejects late votes on approved proposals.","26228","test_sequential_voting_reaches_threshold","Near Citizens House","Wed Dec 17 21:16:22 UTC 2025","passed","Wed Dec 17 21:16:48 UTC 2025","Edge Cases","Sputnik Bridge Integration Tests","",""
"","0","rejects accounts starting with separator","Near Citizens House","Wed Dec 17 20:56:47 UTC 2025","passed","Wed Dec 17 20:56:47 UTC 2025","NEAR Account Validation > nearNamedAccountSchema > invalid named accounts","Shared Library Unit Tests","",""
"Verifies u64::MAX input causes overflow panic (u64::MAX * 7 overflows).","25","test_quorum_overflow_panics","Near Citizens House","Wed Dec 17 20:57:42 UTC 2025","passed","Wed Dec 17 20:57:42 UTC 2025","Quorum Overflow","Sputnik Bridge Unit Tests","",""
"","0","returns true for valid accounts","Near Citizens House","Wed Dec 17 20:56:47 UTC 2025","passed","Wed Dec 17 20:56:47 UTC 2025","NEAR Account Validation > isValidNearAccountId","Shared Library Unit Tests","",""
"","60","should return false for invalid proof","Near Citizens House","Wed Dec 17 20:56:44 UTC 2025","passed","Wed Dec 17 20:56:44 UTC 2025","ZK Verification > verifyStoredProof > Negative Tests","Shared Library Unit Tests","",""
"","1","should preserve array nonce format","Near Citizens House","Wed Dec 17 20:56:43 UTC 2025","passed","Wed Dec 17 20:56:43 UTC 2025","NEP-413 Verification > parseUserContextData > Positive Tests","Shared Library Unit Tests","",""
"Verifies that unicode characters in user_context_data are handled correctly.","4205","test_unicode_in_user_context_data","Near Citizens House","Wed Dec 17 21:06:47 UTC 2025","passed","Wed Dec 17 21:06:51 UTC 2025","Edge Cases","Verified Accounts Integration Tests","",""
"Verifies that store_verification rejects when signature recipient doesn't match near_account_id parameter.","51","test_recipient_mismatch","Near Citizens House","Wed Dec 17 20:57:32 UTC 2025","passed","Wed Dec 17 20:57:32 UTC 2025","Input Validation","Verified Accounts Unit Tests","",""
"","0","should return error for malformed signature","Near Citizens House","Wed Dec 17 20:56:43 UTC 2025","passed","Wed Dec 17 20:56:43 UTC 2025","NEP-413 Verification > verifyNearSignature > Negative Tests","Shared Library Unit Tests","",""
"Documents serialization behavior for WeightOrRatio::Ratio with zero denominator. This dangerous edge case (potential division-by-zero) is allowed at the type level. Consuming DAO contracts must validate that Ratio denominators are non-zero.","0","test_weight_or_ratio_zero_denominator_serialization","Near Citizens House","Wed Dec 17 20:57:45 UTC 2025","passed","Wed Dec 17 20:57:45 UTC 2025","Serialization","Sputnik DAO Interface Tests","",""
"Verifies that store_verification requires exactly 1 yoctoNEAR deposit. This prevents accidental calls and provides a small security measure.","4728","test_store_verification_requires_one_yocto","Near Citizens House","Wed Dec 17 21:06:29 UTC 2025","passed","Wed Dec 17 21:06:34 UTC 2025","Access Control","Verified Accounts Integration Tests","",""
"","0","test_role_permission_borsh_roundtrip","Near Citizens House","Wed Dec 17 20:57:45 UTC 2025","passed","Wed Dec 17 20:57:45 UTC 2025","Serialization","Sputnik DAO Interface Tests","",""
"Verifies that after wallet rotation, the old backend wallet is blocked from bridge write operations while the new backend wallet has full access. Security-critical test.","10724","test_backend_wallet_rotation_enforced","Near Citizens House","Wed Dec 17 21:09:06 UTC 2025","passed","Wed Dec 17 21:09:17 UTC 2025","Backend Wallet Management","Sputnik Bridge Integration Tests","",""
"Verifies that bridge initialization succeeds even if the verified-accounts contract doesn't exist. Cross-contract calls will fail later.","3833","test_init_with_nonexistent_verified_accounts","Near Citizens House","Wed Dec 17 21:19:31 UTC 2025","passed","Wed Dec 17 21:19:35 UTC 2025","Contract Setup","Sputnik Bridge Integration Tests","",""
"","311","should successfully connect to at least one RPC endpoint","Near Citizens House","Wed Dec 17 20:56:45 UTC 2025","passed","Wed Dec 17 20:56:46 UTC 2025","ZK Verification > RPC Failover Mechanism > Happy Path","Shared Library Unit Tests","",""
"","1","should throw for short nonce (31 bytes)","Near Citizens House","Wed Dec 17 20:56:43 UTC 2025","passed","Wed Dec 17 20:56:43 UTC 2025","NEP-413 Verification > computeNep413Hash > Boundary Tests","Shared Library Unit Tests","",""
"Verifies that store_verification rejects ZK proof with any public_signal string exceeding 80 character maximum length.","50","test_public_signal_item_too_long","Near Citizens House","Wed Dec 17 20:57:33 UTC 2025","passed","Wed Dec 17 20:57:33 UTC 2025","Proof Validation","Verified Accounts Unit Tests","",""
"","0","test_self_proof_data_invalid_proof_type_fails","Near Citizens House","Wed Dec 17 20:57:36 UTC 2025","passed","Wed Dec 17 20:57:36 UTC 2025","Validation","Verified Accounts Interface Tests","",""
"Verifies that pagination handles large limit values gracefully on empty data without panicking.","50","test_pagination_with_large_limit_on_empty","Near Citizens House","Wed Dec 17 20:57:33 UTC 2025","passed","Wed Dec 17 20:57:33 UTC 2025","Read Functions","Verified Accounts Unit Tests","",""
"Test 1.1.6: Verifies that the contract can be initialized with an implicit account (64 hex chars) as backend wallet.","2682","test_init_with_implicit_account_backend","Near Citizens House","Wed Dec 17 21:06:51 UTC 2025","passed","Wed Dec 17 21:06:54 UTC 2025","Initialization","Verified Accounts Integration Tests","",""
"Verifies that invalid signatures (all zeros) are rejected.","4203","test_invalid_signature_rejected","Near Citizens House","Wed Dec 17 21:07:51 UTC 2025","passed","Wed Dec 17 21:07:55 UTC 2025","Signature Verification","Verified Accounts Integration Tests","",""
"Verifies 1000 * 7 / 100 = 70.0 exactly.","0","test_quorum_with_1000_citizens_equals_70","Near Citizens House","Wed Dec 17 20:57:42 UTC 2025","passed","Wed Dec 17 20:57:42 UTC 2025","Quorum Calculation","Sputnik Bridge Unit Tests","",""
"Verifies that the member_added event is emitted when a member is successfully added to the DAO with correct event data.","8439","test_member_added_event_emitted","Near Citizens House","Wed Dec 17 21:09:14 UTC 2025","passed","Wed Dec 17 21:09:22 UTC 2025","Events","Sputnik Bridge Integration Tests","",""
"","2","should handle very long message","Near Citizens House","Wed Dec 17 20:56:43 UTC 2025","passed","Wed Dec 17 20:56:43 UTC 2025","NEP-413 Verification > computeNep413Hash > Edge Cases","Shared Library Unit Tests","",""
"Verifies that calculated quorum never exceeds the total citizen count.","0","test_invariant_quorum_never_exceeds_citizen_count","Near Citizens House","Wed Dec 17 20:57:42 UTC 2025","passed","Wed Dec 17 20:57:42 UTC 2025","Invariants","Sputnik Bridge Unit Tests","",""
"Verifies that only the current backend wallet can update the backend wallet and unauthorized accounts are rejected.","88","test_unauthorized_update_backend_wallet","Near Citizens House","Wed Dec 17 20:57:32 UTC 2025","passed","Wed Dec 17 20:57:32 UTC 2025","Backend Wallet Management","Verified Accounts Unit Tests","",""
"
## Purpose
Verifies that proposal IDs are sequential with no gaps.

## Test 13.3.3 - proposal_count_consistency

## Invariant
Proposal IDs increment by 1 for each proposal, starting from 0.
","14499","test_proposal_count_consistency","Near Citizens House","Wed Dec 17 21:20:01 UTC 2025","passed","Wed Dec 17 21:20:15 UTC 2025","State Consistency","Sputnik Bridge Integration Tests","",""
"Verifies that a single-character description passes validation.","50","test_description_boundary_single_char_passes","Near Citizens House","Wed Dec 17 20:57:42 UTC 2025","passed","Wed Dec 17 20:57:42 UTC 2025","Description Validation","Sputnik Bridge Unit Tests","",""
"","60","should return correct public signals count","Near Citizens House","Wed Dec 17 20:56:45 UTC 2025","passed","Wed Dec 17 20:56:45 UTC 2025","ZK Verification > verifyStoredProofWithDetails > Positive Tests","Shared Library Unit Tests","",""
"","0","test_action_serialization","Near Citizens House","Wed Dec 17 20:57:45 UTC 2025","passed","Wed Dec 17 20:57:45 UTC 2025","Serialization","Sputnik DAO Interface Tests","",""
"Verifies that account ID mismatch between near_account_id and signature_data.account_id is rejected.","4235","test_account_id_mismatch","Near Citizens House","Wed Dec 17 21:06:54 UTC 2025","passed","Wed Dec 17 21:06:58 UTC 2025","Input Validation","Verified Accounts Integration Tests","",""
"
## Purpose
Verifies that add_member proposals are auto-approved by the bridge.

## Mechanism
Bridge has council role and auto-votes approve on AddMemberToRole proposals.
","8922","test_add_member_auto_approves","Near Citizens House","Wed Dec 17 21:17:20 UTC 2025","passed","Wed Dec 17 21:17:29 UTC 2025","Member Addition","Sputnik Bridge Integration Tests","",""
"","0","rejects empty string","Near Citizens House","Wed Dec 17 20:56:47 UTC 2025","passed","Wed Dec 17 20:56:47 UTC 2025","NEAR Account Validation > nearAccountIdSchema","Shared Library Unit Tests","",""
"","0","should include ZK proof data","Near Citizens House","Wed Dec 17 20:56:43 UTC 2025","passed","Wed Dec 17 20:56:43 UTC 2025","NEP-413 Verification > buildProofData > Positive Tests","Shared Library Unit Tests","",""
"Verifies callback successfully processes proposal creation and schedules act_proposal.","50","test_callback_proposal_created","Near Citizens House","Wed Dec 17 20:57:42 UTC 2025","passed","Wed Dec 17 20:57:42 UTC 2025","Callbacks","Sputnik Bridge Unit Tests","",""
"","0","identifies ETH-implicit accounts","Near Citizens House","Wed Dec 17 20:56:47 UTC 2025","passed","Wed Dec 17 20:56:47 UTC 2025","NEAR Account Validation > getNearAccountType","Shared Library Unit Tests","",""
"Documents that quorum failing while threshold passes is impossible due to effective_threshold = max(quorum, threshold_weight).","39042","test_vote_proposal_quorum_fails_threshold_passes_impossible","Near Citizens House","Wed Dec 17 21:12:19 UTC 2025","passed","Wed Dec 17 21:12:58 UTC 2025","Dynamic Quorum","Sputnik Bridge Integration Tests","",""
"","1","accepts standard named accounts","Near Citizens House","Wed Dec 17 20:56:47 UTC 2025","passed","Wed Dec 17 20:56:47 UTC 2025","NEAR Account Validation > nearNamedAccountSchema > valid named accounts","Shared Library Unit Tests","",""
"","61","should handle maximum attestation ID (3)","Near Citizens House","Wed Dec 17 20:56:45 UTC 2025","passed","Wed Dec 17 20:56:45 UTC 2025","ZK Verification > verifyStoredProofWithDetails > Boundary Tests","Shared Library Unit Tests","",""
"Tests serialization with realistic 21 public signals from passport proofs","0","test_verified_account_with_21_signals","Near Citizens House","Wed Dec 17 20:57:36 UTC 2025","passed","Wed Dec 17 20:57:36 UTC 2025","Serialization","Verified Accounts Interface Tests","",""
"Verifies that the bridge contract cannot be initialized twice.","5351","test_init_cannot_reinitialize","Near Citizens House","Wed Dec 17 21:19:27 UTC 2025","passed","Wed Dec 17 21:19:32 UTC 2025","Contract Setup","Sputnik Bridge Integration Tests","",""
"","0","accepts deeply nested subaccounts","Near Citizens House","Wed Dec 17 20:56:47 UTC 2025","passed","Wed Dec 17 20:56:47 UTC 2025","NEAR Account Validation > nearNamedAccountSchema > valid named accounts","Shared Library Unit Tests","",""
"","53","should handle well-formed proof structure","Near Citizens House","Wed Dec 17 20:56:44 UTC 2025","passed","Wed Dec 17 20:56:44 UTC 2025","ZK Verification > verifyStoredProof > Happy Path (Network Connectivity)","Shared Library Unit Tests","",""
"","1","test_empty_group_serialization","Near Citizens House","Wed Dec 17 20:57:45 UTC 2025","passed","Wed Dec 17 20:57:45 UTC 2025","Serialization","Sputnik DAO Interface Tests","",""
"
## Purpose
Verifies that single character descriptions are valid (minimum valid length).

## Boundary Test
- Input: ""x"" (1 character, limit - 0)
- Expected: Succeeds
","5834","test_create_proposal_single_char_description","Near Citizens House","Wed Dec 17 21:18:12 UTC 2025","passed","Wed Dec 17 21:18:18 UTC 2025","Proposal Validation","Sputnik Bridge Integration Tests","",""
"
## Purpose
Verifies that VoteReject from a single citizen results in Rejected status.

## Expected
With only 1 citizen voting reject, proposal status becomes Rejected.
","10416","test_citizen_vote_reject","Near Citizens House","Wed Dec 17 21:20:26 UTC 2025","passed","Wed Dec 17 21:20:36 UTC 2025","Citizen Voting","Sputnik Bridge Integration Tests","",""
"Verifies backend wallet can successfully update to a new wallet address with 1 yocto deposit.","50","test_update_backend_wallet","Near Citizens House","Wed Dec 17 20:57:42 UTC 2025","passed","Wed Dec 17 20:57:42 UTC 2025","Backend Wallet Management","Sputnik Bridge Unit Tests","",""
"Verifies that signatures shorter than 64 bytes are rejected.","48","test_invalid_signature_length","Near Citizens House","Wed Dec 17 20:57:33 UTC 2025","passed","Wed Dec 17 20:57:33 UTC 2025","Signature Verification","Verified Accounts Unit Tests","",""
"","1","rejects invalid characters","Near Citizens House","Wed Dec 17 20:56:47 UTC 2025","passed","Wed Dec 17 20:56:47 UTC 2025","NEAR Account Validation > nearNamedAccountSchema > invalid named accounts","Shared Library Unit Tests","",""
"","3","should handle empty challenge message","Near Citizens House","Wed Dec 17 20:56:43 UTC 2025","passed","Wed Dec 17 20:56:43 UTC 2025","NEP-413 Verification > verifyNearSignature > Edge Cases","Shared Library Unit Tests","",""
