"DESCRIPTION","DURATION IN MS","NAME","PARENT SUITE","START TIME","STATUS","STOP TIME","SUB SUITE","SUITE","TEST CLASS","TEST METHOD"
"","66","should include RPC URL used for verification","Near Citizens House","Sun Jan 04 17:00:14 UTC 2026","passed","Sun Jan 04 17:00:14 UTC 2026","ZK Verification > verifyStoredProofWithDetails > Happy Path","Shared Library Unit Tests","",""
"","0","accepts accounts with underscores and hyphens","Near Citizens House","Sun Jan 04 17:00:13 UTC 2026","passed","Sun Jan 04 17:00:13 UTC 2026","NEAR Account Validation > nearNamedAccountSchema > valid named accounts","Shared Library Unit Tests","",""
"","0","test_role_permission_borsh_roundtrip","Near Citizens House","Sun Jan 04 17:00:30 UTC 2026","passed","Sun Jan 04 17:00:30 UTC 2026","Serialization","Sputnik DAO Interface Tests","",""
"","0","should handle unicode messages correctly","Near Citizens House","Sun Jan 04 17:00:13 UTC 2026","passed","Sun Jan 04 17:00:13 UTC 2026","NEP-413 Verification > computeNep413Hash > Edge Cases","Shared Library Unit Tests","",""
"","0","test_zk_proof_json_invalid_a_array_length_fails","Near Citizens House","Sun Jan 04 17:00:28 UTC 2026","passed","Sun Jan 04 17:00:28 UTC 2026","Validation","Verified Accounts Interface Tests","",""
"","0","rejects wrong length","Near Citizens House","Sun Jan 04 17:00:13 UTC 2026","passed","Sun Jan 04 17:00:13 UTC 2026","NEAR Account Validation > ethImplicitAccountSchema > invalid ETH-implicit accounts","Shared Library Unit Tests","",""
"V1 nullifier protection works correctly.","4076","test_v1_nullifier_protection","Near Citizens House","Sun Jan 04 17:04:44 UTC 2026","passed","Sun Jan 04 17:04:48 UTC 2026","Versioning","Verified Accounts Integration Tests","",""
"Test 2.7.2: Verifies that read operations (is_verified, get_verified_count, list_verifications) still work when the contract is paused.","576","test_pause_allows_read_operations","Near Citizens House","Sun Jan 04 17:04:37 UTC 2026","failed","Sun Jan 04 17:04:38 UTC 2026","Pause/Unpause","Verified Accounts Integration Tests","",""
"","0","test_zk_proof_json_missing_b_field_fails","Near Citizens House","Sun Jan 04 17:00:28 UTC 2026","passed","Sun Jan 04 17:00:28 UTC 2026","Validation","Verified Accounts Interface Tests","",""
"","0","should handle nonce with all 0xFF values (max byte)","Near Citizens House","Sun Jan 04 17:00:13 UTC 2026","passed","Sun Jan 04 17:00:13 UTC 2026","NEP-413 Verification > computeNep413Hash > Boundary Tests","Shared Library Unit Tests","",""
"","0","rejects empty string","Near Citizens House","Sun Jan 04 17:00:13 UTC 2026","passed","Sun Jan 04 17:00:13 UTC 2026","NEAR Account Validation > nearAccountIdSchema","Shared Library Unit Tests","",""
"Verifies unauthorized account cannot update backend wallet and receives appropriate error.","35","test_update_backend_wallet_unauthorized","Near Citizens House","Sun Jan 04 17:00:30 UTC 2026","passed","Sun Jan 04 17:00:30 UTC 2026","Backend Wallet Management","Sputnik Bridge Unit Tests","",""
"","0","returns true for valid accounts","Near Citizens House","Sun Jan 04 17:00:13 UTC 2026","passed","Sun Jan 04 17:00:13 UTC 2026","NEAR Account Validation > isValidNearAccountId","Shared Library Unit Tests","",""
"","0","rejects uppercase hex","Near Citizens House","Sun Jan 04 17:00:13 UTC 2026","passed","Sun Jan 04 17:00:13 UTC 2026","NEAR Account Validation > nearImplicitAccountSchema > invalid implicit accounts","Shared Library Unit Tests","",""
"","68","should return false for invalid proof","Near Citizens House","Sun Jan 04 17:00:13 UTC 2026","passed","Sun Jan 04 17:00:13 UTC 2026","ZK Verification > verifyStoredProof > Negative Tests","Shared Library Unit Tests","",""
"Verifies that changing the nonce after signing invalidates the signature.","19","test_signature_wrong_nonce_rejected","Near Citizens House","Sun Jan 04 17:00:28 UTC 2026","passed","Sun Jan 04 17:00:28 UTC 2026","Signature Verification","Verified Accounts Unit Tests","",""
"","69","should handle well-formed proof structure","Near Citizens House","Sun Jan 04 17:00:13 UTC 2026","passed","Sun Jan 04 17:00:13 UTC 2026","ZK Verification > verifyStoredProof > Happy Path (Network Connectivity)","Shared Library Unit Tests","",""
"Verifies callback emits member_added event and schedules get_policy when member is successfully added.","13","test_callback_member_added","Near Citizens House","Sun Jan 04 17:00:30 UTC 2026","passed","Sun Jan 04 17:00:30 UTC 2026","Callbacks","Sputnik Bridge Unit Tests","",""
"","69","should return error message when all RPCs fail","Near Citizens House","Sun Jan 04 17:00:14 UTC 2026","passed","Sun Jan 04 17:00:14 UTC 2026","ZK Verification > verifyStoredProofWithDetails > Negative Tests","Shared Library Unit Tests","",""
"","0","test_weight_or_ratio_weight_serialization","Near Citizens House","Sun Jan 04 17:00:30 UTC 2026","passed","Sun Jan 04 17:00:30 UTC 2026","Serialization","Sputnik DAO Interface Tests","",""
"","0","identifies implicit accounts","Near Citizens House","Sun Jan 04 17:00:13 UTC 2026","passed","Sun Jan 04 17:00:13 UTC 2026","NEAR Account Validation > getNearAccountType","Shared Library Unit Tests","",""
"","137","should handle different attestation IDs consistently","Near Citizens House","Sun Jan 04 17:00:14 UTC 2026","passed","Sun Jan 04 17:00:15 UTC 2026","ZK Verification > verifyStoredProofWithDetails > Edge Cases","Shared Library Unit Tests","",""
"Verifies that the backend wallet can be updated and the new wallet gains proper permissions.","731","test_update_backend_wallet","Near Citizens House","Sun Jan 04 17:04:36 UTC 2026","failed","Sun Jan 04 17:04:37 UTC 2026","Access Control","Verified Accounts Integration Tests","",""
"Verifies that a description with exactly 10,000 characters (at limit) passes validation.","15","test_description_boundary_at_limit_passes","Near Citizens House","Sun Jan 04 17:00:30 UTC 2026","passed","Sun Jan 04 17:00:30 UTC 2026","Description Validation","Sputnik Bridge Unit Tests","",""
"Verifies duplicate nullifiers are rejected even for different accounts.","26","test_nullifier_reuse_rejected","Near Citizens House","Sun Jan 04 17:00:28 UTC 2026","passed","Sun Jan 04 17:00:28 UTC 2026","Store Verification","Verified Accounts Unit Tests","",""
"","0","test_role_permission_missing_name_fails","Near Citizens House","Sun Jan 04 17:00:30 UTC 2026","passed","Sun Jan 04 17:00:30 UTC 2026","Validation","Sputnik DAO Interface Tests","",""
"","0","should handle malformed proof with missing fields","Near Citizens House","Sun Jan 04 17:00:14 UTC 2026","passed","Sun Jan 04 17:00:14 UTC 2026","ZK Verification > verifyStoredProofWithDetails > Negative Tests","Shared Library Unit Tests","",""
"Verifies that changing the challenge after signing invalidates the signature.","20","test_signature_wrong_challenge_rejected","Near Citizens House","Sun Jan 04 17:00:28 UTC 2026","passed","Sun Jan 04 17:00:28 UTC 2026","Signature Verification","Verified Accounts Unit Tests","",""
"
## Purpose
Verifies that VersionedVerification enum discriminants remain constant for record migration.

## Why This Matters
- If VersionedVerification::V1 discriminant changes, existing records become unreadable
- Lazy migration relies on correctly deserializing V1 records

## Expected Values
- V1: 0x00
","1","test_versioned_verification_discriminants_are_stable","Near Citizens House","Sun Jan 04 17:00:28 UTC 2026","passed","Sun Jan 04 17:00:28 UTC 2026","Storage Stability","Verified Accounts Unit Tests","",""
"","71","should include verifier address on success","Near Citizens House","Sun Jan 04 17:00:14 UTC 2026","passed","Sun Jan 04 17:00:14 UTC 2026","ZK Verification > verifyStoredProofWithDetails > Happy Path","Shared Library Unit Tests","",""
